{
  "content_section": "Projects",
  "reel_type": "Project Showcase",
  "working_title": "The Courtyard Is the Real Lobby",
  "hook": "In tropical hospitality, the arrival sequence should not end at the front door.",
  "core_message": "For Anusara, the courtyard is planned as the first shared guest experience while landscape and geometry protect privacy.",
  "story_structure": "Arrival establishes the question, the courtyard shows the hospitality sequence, and the final scene explains how privacy is protected.",
  "cta": "Follow Montanum for development-driven design insights.",
  "voiceover_script": "In tropical hospitality, the arrival sequence should not end at the front door. At Anusara, the courtyard becomes the first shared guest experience. Landscape, shade, and circulation create an open arrival while the building geometry protects privacy between rooms. The result is not simply a lobby. It is a more considered way to begin the stay.",
  "subtitle_script": "In tropical hospitality, the arrival sequence should not end at the front door. At Anusara, the courtyard becomes the first shared guest experience. Landscape, shade, and circulation create an open arrival while the building geometry protects privacy between rooms. The result is not simply a lobby. It is a more considered way to begin the stay.",
  "caption": "A hospitality arrival begins before a guest reaches the room. For Anusara, the courtyard is part of the operational and emotional sequence: open enough to feel welcoming, controlled enough to preserve privacy.",
  "hashtags": "#HospitalityDesign #Architecture #BaliArchitecture #ResortDesign #Masterplanning #Montanum",
  "target_duration_seconds": 28,
  "aspect_ratio": "9:16",
  "language": "English",
  "media_selection_notes": "Use the arrival video for the hook, then hold on the courtyard and privacy renders to explain the sequence and screening logic.",
  "missing_media": [],
  "rendering_readiness": "ready",
  "scenes": [
    {
      "scene_id": "scene_brief_B042_01",
      "sequence": 1,
      "duration_seconds": 7,
      "source_bundle_media_id": "recMediaExampleVideo001",
      "source_asset_type": "original_video",
      "purpose": "hook",
      "overlay_text": "Arrival is part of the design.",
      "voiceover_segment": "In tropical hospitality, the arrival sequence should not end at the front door.",
      "subtitle_segment": "In tropical hospitality, the arrival sequence should not end at the front door.",
      "transition": "cut",
      "crop_and_fit_mode": "cover",
      "output_aspect_ratio": "9:16",
      "generation_requirement": "none"
    },
    {
      "scene_id": "scene_brief_B042_02",
      "sequence": 2,
      "duration_seconds": 10,
      "source_bundle_media_id": "recMediaExamplePhoto001",
      "source_asset_type": "render",
      "purpose": "context",
      "overlay_text": "The courtyard becomes the first shared guest experience.",
      "voiceover_segment": "At Anusara, the courtyard becomes the first shared guest experience. Landscape, shade, and circulation create an open arrival.",
      "subtitle_segment": "At Anusara, the courtyard becomes the first shared guest experience. Landscape, shade, and circulation create an open arrival.",
      "transition": "cut",
      "crop_and_fit_mode": "cover",
      "output_aspect_ratio": "9:16",
      "generation_requirement": "none"
    },
    {
      "scene_id": "scene_brief_B042_03",
      "sequence": 3,
      "duration_seconds": 11,
      "source_bundle_media_id": "recMediaExamplePhoto002",
      "source_asset_type": "render",
      "purpose": "development_logic",
      "overlay_text": "Open arrival. Protected privacy.",
      "voiceover_segment": "The building geometry protects privacy between rooms. The result is not simply a lobby. It is a more considered way to begin the stay.",
      "subtitle_segment": "The building geometry protects privacy between rooms. The result is not simply a lobby. It is a more considered way to begin the stay.",
      "transition": "cut",
      "crop_and_fit_mode": "cover",
      "output_aspect_ratio": "9:16",
      "generation_requirement": "none"
    }
  ]
}
